{
  "schema_version": "1.0.0",
  "bundle_id": "0e192a9620ebe81a28a9804984151a1b0862e32c93c109524dc03dd25ec65a99",
  "generated_at": "2026-07-05T13:00:00Z",
  "bundle_window_start": "2026-05-01T00:00:00Z",
  "bundle_window_end": "2026-07-31T23:59:59Z",
  "regulation_refs": [
    "nis2:art-20",
    "nis2:art-21-2-b",
    "nis2:art-22",
    "nis2:art-23"
  ],
  "streams": [
    {
      "stream": "risk-analysis",
      "feature_ref": "F-CP-01",
      "present": false,
      "schema_ref": "schemas/evidence/risk-analysis.schema.json",
      "artifact_paths": [],
      "artifact_count": 0,
      "regulation_refs": [
        "nis2:art-21-2-a"
      ]
    },
    {
      "stream": "incidents",
      "feature_ref": "F-CP-02",
      "present": true,
      "schema_ref": "schemas/evidence/incidents.schema.json",
      "artifact_paths": [
        "content/evidence/incidents/9f8cf6e9db6e09787e342124cf9f02a95f7bc3bdb328604cd59f8f455dbef8cc.json"
      ],
      "artifact_count": 1,
      "regulation_refs": [
        "nis2:art-21-2-b",
        "nis2:art-23"
      ]
    },
    {
      "stream": "supply-chain",
      "feature_ref": "F-CP-03",
      "present": false,
      "schema_ref": "schemas/evidence/supply-chain.schema.json",
      "artifact_paths": [],
      "artifact_count": 0,
      "regulation_refs": [
        "nis2:art-21-2-d",
        "nis2:art-22"
      ]
    },
    {
      "stream": "vulns",
      "feature_ref": "F-CP-04",
      "present": false,
      "schema_ref": "schemas/evidence/vulns.schema.json",
      "artifact_paths": [],
      "artifact_count": 0,
      "regulation_refs": [
        "nis2:art-21-2-e"
      ]
    },
    {
      "stream": "crypto",
      "feature_ref": "F-CP-05",
      "present": false,
      "schema_ref": "schemas/evidence/crypto-attestation.schema.json",
      "artifact_paths": [],
      "artifact_count": 0,
      "regulation_refs": [
        "nis2:art-21-2-h"
      ]
    },
    {
      "stream": "effectiveness",
      "feature_ref": "F-CP-06",
      "present": false,
      "schema_ref": "schemas/evidence/effectiveness.schema.json",
      "artifact_paths": [],
      "artifact_count": 0,
      "regulation_refs": [
        "nis2:art-21-2-f"
      ],
      "notes": "stream gated on F-CP-06; empty slot until shipped"
    },
    {
      "stream": "access",
      "feature_ref": "F-CP-07",
      "present": true,
      "schema_ref": "schemas/evidence/access.schema.json",
      "artifact_paths": [
        "content/evidence/access/716b000010216f4106341298fb713650b6ebc6672423dc685abc933f57b2e152.json"
      ],
      "artifact_count": 1,
      "regulation_refs": [
        "nis2:art-21-2-i"
      ]
    }
  ],
  "provenance": {
    "source_url": "https://example.org/runs/incident-management-example-0001",
    "captured_at": "2026-07-05T13:00:00Z",
    "commit_sha": "d31a3a7"
  },
  "owner": {
    "role": "compliance-wg",
    "assigned_at": "2026-01-15"
  },
  "retention": "P2Y"
}